{
  "trace_id": "trace-portfolio-tracker-kickoff-2026-02-28",
  "task_id": "T-kickoff-ct-bootstrap-2026-02-28",
  "worker": "generic_worker",
  "what_changed": [
    "Recovered backend execution environment at C:\\venvs_hub\\portfolio_tracker_dev and completed dependency bootstrap.",
    "Ran control-tower gates (contracts, skill registry strict, compileall) and all passed.",
    "Fixed backend summary endpoint runtime error by normalizing latest numeric extraction in portfolio_service.",
    "Completed backend smoke checks for /health, /api/portfolio/summary, /api/macro-vitals, /api/stress-test.",
    "Installed frontend dependencies and verified Next.js dev server startup on localhost:3000.",
    "Published canonical kickoff artifacts: orchestration/task.json and orchestration/results/kickoff_baseline.result.json."
  ],
  "validation": [
    {
      "name": "orchestration_contract_validation",
      "command": "C:\\venvs_hub\\portfolio_tracker_dev\\Scripts\\python.exe tools\\validate_contracts.py",
      "outcome": "pass"
    },
    {
      "name": "skill_registry_strict_check",
      "command": "C:\\venvs_hub\\portfolio_tracker_dev\\Scripts\\python.exe tools\\check_skill_registry.py --mode strict",
      "outcome": "pass"
    },
    {
      "name": "python_compile_check",
      "command": "C:\\venvs_hub\\portfolio_tracker_dev\\Scripts\\python.exe -m compileall -q tools backend/app",
      "outcome": "pass"
    },
    {
      "name": "backend_runtime_smoke",
      "command": "uvicorn backend.app.main:app --host 127.0.0.1 --port 8000",
      "outcome": "pass"
    },
    {
      "name": "frontend_runtime_smoke",
      "command": "npm run dev -- -H 127.0.0.1 -p 3000",
      "outcome": "pass"
    }
  ],
  "risks": [
    {
      "severity": "medium",
      "description": "Frontend dependency set includes deprecated packages and a Next.js 14.1.0 security advisory warning."
    },
    {
      "severity": "low",
      "description": "Local harness may require pinned interpreter path for project Python commands in some sessions."
    }
  ],
  "next_3_actions": [
    "Issue Phase 2 frontend ticket to wire dashboard to /api/portfolio/summary, /api/macro-vitals, and /api/stress-test.",
    "Issue transaction form ticket for POST /api/transactions with validation and API error handling.",
    "Update integration_status.md with kickoff baseline completion and dependency-risk tracking."
  ],
  "timestamp": "2026-02-28T16:03:00Z"
}
